12:10:07.926204 IP 192.168.70.197.53222 > 52.214.174.28.https: Flags [P.], seq 3605326717:3605326823, ack 3659489055, win 501, options [nop,nop,TS val 3876894305 ecr 2955270021], length 106
12:10:08.694761 IP 192.168.70.197.58026 > 2.22.220.225.https: Flags [P.], seq 4027770813:4027770852, ack 1769470938, win 501, options [nop,nop,TS val 2698402555 ecr 291928479], length 39

od.eu-west-1.forester.a2z.com., CNAME endpoint.prod.eu-west-1.forester.a2z.com., A 34.252.197.71, A 34.248.226.43, A 52.214.250.165, A 108.128.170.77, A 54.74.78.247, A 52.209.100.147, A 34.240.60.211, A 63.32.204.145 (277)
12:10:00.202868 IP 192.168.70.197.55830 > _gateway.domain: 47353+ [1au] AAAA? endpoint.prod.eu-west-1.forester.a2z.com. (69)
12:10:00.238960 IP _gateway.domain > 192.168.70.197.55830: 47353 0/1/1 (150)
12:10:01.901714 IP 192.168.70.197.58026 > 2.22.220.225.https: Flags [P.], seq 4027770813:4027770852, ack 1769470938, win 501, options [nop,nop,TS val 2698395762 ecr 291928479], length 39
12:10:02.113844 IP 192.168.70.197.58026 > 2.22.220.225.https: Flags [P.], seq 0:39, ack 1, win 501, options [nop,nop,TS val 2698395975 ecr 291928479], length 39
12:10:02.326566 IP 192.168.70.197.58026 > 2.22.220.225.https: Flags [P.], seq 0:39, ack 1, win 501, options [nop,nop,TS val 2698396187 ecr 291928479], length 39
12:10:02.775087 IP 192.168.70.197.58026 > 2.22.220.225.https: Flags [P.], seq 0:39, ack 1, win 501, options [nop,nop,TS val 2698396636 ecr 291928479], length 39
12:10:03.638338 IP 192.168.70.197.58026 > 2.22.220.225.https: Flags [P.], seq 0:39, ack 1, win 501, options [nop,nop,TS val 2698397499 ecr 291928479], length 39
12:10:05.334717 IP 192.168.70.197.58026 > 2.22.220.225.https: Flags [P.], seq 0:39, ack 1, win 501, options [nop,nop,TS val 2698399196 ecr 291928479], length 39
12:10:07.926204 IP 192.168.70.197.53222 > 52.214.174.28.https: Flags [P.], seq 3605326717:3605326823, ack 3659489055, win 501, options [nop,nop,TS val 3876894305 ecr 2955270021], length 106
12:10:08.694761 IP 192.168.70.197.58026 > 2.22.220.225.https: Flags [P.], seq 0:39, ack 1, win 501, options [nop,nop,TS val 2698402555 ecr 291928479], length 39
12:10:09.977803 IP 192.168.70.197.58026 > 2.22.220.225.https: Flags [FP.], seq 39:102, ack 1, win 501, options [nop,nop,TS val 2698403838 ecr 291928479], length 63
12:10:14.496111 IP 192.168.70.197.42124 > 192.168.110.156.http: Flags [S], seq 2358653652, win 64240, options [mss 1460,sackOK,TS val 1780971258 ecr 0,nop,wscale 7], length 0
12:10:14.497558 IP 192.168.110.156.http > 192.168.70.197.42124: Flags [S.], seq 3478226388, ack 2358653653, win 65160, options [mss 1460,sackOK,TS val 3189701404 ecr 1780971258,nop,wscale 7], length 0
12:10:14.498828 IP 192.168.70.197.42124 > 192.168.110.156.http: Flags [.], ack 1, win 502, options [nop,nop,TS val 1780971261 ecr 3189701404], length 0
12:10:14.499726 IP 192.168.70.197.42124 > 192.168.110.156.http: Flags [P.], seq 1:486, ack 1, win 502, options [nop,nop,TS val 1780971262 ecr 3189701404], length 485: HTTP: GET /owncloud/owncloud/status.php HTTP/1.1
12:10:14.505290 IP 192.168.110.156.http > 192.168.70.197.42124: Flags [.], ack 486, win 506, options [nop,nop,TS val 3189701412 ecr 1780971262], length 0
12:10:14.507032 IP 192.168.110.156.http > 192.168.70.197.42124: Flags [P.], seq 1:551, ack 486, win 506, options [nop,nop,TS val 3189701414 ecr 1780971262], length 550: HTTP: HTTP/1.1 302 Found
12:10:14.508977 IP 192.168.70.197.42124 > 192.168.110.156.http: Flags [.], ack 551, win 501, options [nop,nop,TS val 1780971271 ecr 3189701414], length 0
12:10:14.510602 IP 192.168.70.197.42124 > 192.168.110.156.http: Flags [P.], seq 486:971, ack 551, win 501, options [nop,nop,TS val 1780971272 ecr 3189701414], length 485: HTTP: GET /owncloud/owncloud/status.php HTTP/1.1
12:10:14.511953 IP 192.168.70.197.51430 > helena.http: Flags [S], seq 1878348566, win 64240, options [mss 1460,sackOK,TS val 1598297585 ecr 0,nop,wscale 7], length 0
12:10:14.512933 IP 192.168.70.197.42124 > 192.168.110.156.http: Flags [F.], seq 971, ack 551, win 501, options [nop,nop,TS val 1780971275 ecr 3189701414], length 0
12:10:14.513272 IP helena.http > 192.168.70.197.51430: Flags [S.], seq 2019090141, ack 1878348567, win 65160, options [mss 1460,sackOK,TS val 3189701420 ecr 1598297585,nop,wscale 7], length 0
12:10:14.514361 IP 192.168.70.197.51430 > helena.http: Flags [.], ack 1, win 502, options [nop,nop,TS val 1598297587 ecr 3189701420], length 0
12:10:14.515289 IP 192.168.70.197.51430 > helena.http: Flags [P.], seq 1:465, ack 1, win 502, options [nop,nop,TS val 1598297588 ecr 3189701420], length 464: HTTP: GET /index.php HTTP/1.1
12:10:14.516264 IP helena.http > 192.168.70.197.51430: Flags [.], ack 465, win 506, options [nop,nop,TS val 3189701424 ecr 1598297588], length 0
12:10:14.530077 IP 192.168.70.197.42124 > 192.168.110.156.http: Flags [F.], seq 971, ack 551, win 501, options [nop,nop,TS val 1780971292 ecr 3189701414], length 0
12:10:14.530882 IP 192.168.110.156.http > 192.168.70.197.42124: Flags [.], ack 972, win 503, options [nop,nop,TS val 3189701438 ecr 1780971272,nop,nop,sack 1 {971:972}], length 0
12:10:14.537889 IP helena.http > 192.168.70.197.51430: Flags [P.], seq 1:705, ack 465, win 506, options [nop,nop,TS val 3189701445 ecr 1598297588], length 704: HTTP: HTTP/1.1 200 OK
12:10:14.538715 IP 192.168.70.197.51430 > helena.http: Flags [.], ack 705, win 501, options [nop,nop,TS val 1598297612 ecr 3189701445], length 0
12:10:14.541554 IP 192.168.70.197.51430 > helena.http: Flags [F.], seq 465, ack 705, win 501, options [nop,nop,TS val 1598297614 ecr 3189701445], length 0
12:10:14.594919 IP helena.http > 192.168.70.197.51430: Flags [.], ack 466, win 506, options [nop,nop,TS val 3189701502 ecr 1598297614], length 0
12:10:14.798043 IP 192.168.110.156.http > 192.168.70.197.42124: Flags [R.], seq 551, ack 972, win 503, options [nop,nop,TS val 3189701705 ecr 1780971272], length 0
12:10:14.831704 IP helena.http > 192.168.70.197.51430: Flags [F.], seq 705, ack 466, win 506, options [nop,nop,TS val 3189701739 ecr 1598297614], length 0
12:10:14.832724 IP 192.168.70.197.51430 > helena.http: Flags [.], ack 706, win 501, options [nop,nop,TS val 1598297906 ecr 3189701739], length 0
12:10:15.241077 IP 192.168.70.197.53626 > _gateway.domain: 48154+ [1au] A? c.go-mpulse.net. (44)
12:10:15.297612 IP _gateway.domain > 192.168.70.197.53626: 48154 3/0/1 CNAME wildcard46.go-mpulse.net.edgekey.net., CNAME e4518.dscapi7.akamaiedge.net., A 23.213.44.142 (146)
12:10:15.300172 IP 192.168.70.197.51789 > _gateway.domain: 35200+ [1au] AAAA? e4518.dscapi7.akamaiedge.net. (57)
12:10:15.327875 IP _gateway.domain > 192.168.70.197.51789: 35200 0/0/1 (57)
12:10:15.329934 IP 192.168.70.197.60200 > _gateway.domain: 2322+ [1au] A? detectportal.firefox.com. (53)
12:10:15.343972 IP _gateway.domain > 192.168.70.197.60200: 2322 3/0/1 CNAME detectportal.prod.mozaws.net., CNAME prod.detectportal.prod.cloudops.mozgcp.net., A 34.107.221.82 (164)
12:10:15.345779 IP 192.168.70.197.52300 > _gateway.domain: 16412+ [1au] AAAA? prod.detectportal.prod.cloudops.mozgcp.net. (71)
12:10:15.379310 IP _gateway.domain > 192.168.70.197.52300: 16412 0/0/1 (71)
12:10:15.606074 IP 192.168.70.197.58026 > 2.22.220.225.https: Flags [FP.], seq 0:102, ack 1, win 501, options [nop,nop,TS val 2698409467 ecr 291928479], length 102
12:10:27.244288 IP 192.168.70.197.37469 > _gateway.domain: 21371+ [1au] A? unagi.amazon.es. (44)
12:10:27.246281 IP 192.168.70.197.44868 > _gateway.domain: 50735+ [1au] AAAA? unagi.amazon.es. (44)
12:10:27.400009 IP _gateway.domain > 192.168.70.197.37469: 21371 2/0/1 CNAME unagi-eu.amazon.com., A 67.220.226.172 (93)
12:10:27.402884 IP _gateway.domain > 192.168.70.197.44868: 50735 1/1/1 CNAME unagi-eu.amazon.com. (152)
12:10:27.404816 IP 192.168.70.197.41389 > _gateway.domain: 4773+ [1au] AAAA? unagi-eu.amazon.com. (48)
12:10:27.411118 IP 192.168.70.197.59914 > 67.220.226.172.https: Flags [S], seq 3479552367, win 64240, options [mss 1460,sackOK,TS val 3289940372 ecr 0,nop,wscale 7], length 0
12:10:27.543197 IP _gateway.domain > 192.168.70.197.41389: 4773 0/1/1 (123)
12:10:27.665877 IP 192.168.70.197.59930 > 67.220.226.172.https: Flags [S], seq 4155836079, win 64240, options [mss 1460,sackOK,TS val 3289940627 ecr 0,nop,wscale 7], length 0
12:10:27.863506 IP 192.168.70.197.49757 > _gateway.domain: 9494+ [1au] A? contile.services.mozilla.com. (57)
12:10:27.864792 IP 192.168.70.197.57335 > _gateway.domain: 46642+ [1au] AAAA? contile.services.mozilla.com. (57)
12:10:27.936345 IP _gateway.domain > 192.168.70.197.49757: 9494 1/0/1 A 34.117.188.166 (73)
12:10:27.937245 IP _gateway.domain > 192.168.70.197.57335: 46642 0/1/1 (138)
12:10:27.954465 IP 192.168.70.197.46784 > 34.117.188.166.https: Flags [S], seq 4061586300, win 64240, options [mss 1460,sackOK,TS val 4113560445 ecr 0,nop,wscale 7], length 0
12:10:27.956236 IP 192.168.70.197.59488 > _gateway.domain: 38671+ [1au] A? spocs.getpocket.com. (48)
12:10:27.957950 IP 192.168.70.197.41996 > _gateway.domain: 12114+ [1au] AAAA? spocs.getpocket.com. (48)
12:10:27.970097 IP 192.168.70.197.53372 > 34.149.97.1.https: Flags [S], seq 2800748576, win 64240, options [mss 1460,sackOK,TS val 2300060606 ecr 0,nop,wscale 7], length 0
12:10:27.992294 IP 192.168.70.197.51783 > _gateway.domain: 14186+ [1au] A? incoming.telemetry.mozilla.org. (59)
12:10:27.992294 IP 192.168.70.197.59292 > _gateway.domain: 63189+ [1au] AAAA? incoming.telemetry.mozilla.org. (59)
12:10:28.094765 IP _gateway.domain > 192.168.70.197.59488: 38671 2/0/1 CNAME prod.ads.prod.webservices.mozgcp.net., A 34.117.188.166 (114)
12:10:28.097835 IP _gateway.domain > 192.168.70.197.41996: 12114 1/1/1 CNAME prod.ads.prod.webservices.mozgcp.net. (188)
12:10:28.099530 IP 192.168.70.197.49479 > _gateway.domain: 13169+ [1au] AAAA? prod.ads.prod.webservices.mozgcp.net. (65)
12:10:28.101511 IP 192.168.70.197.46798 > 34.117.188.166.https: Flags [S], seq 3946425765, win 64240, options [mss 1460,sackOK,TS val 4113560592 ecr 0,nop,wscale 7], length 0
12:10:28.130988 IP _gateway.domain > 192.168.70.197.51783: 14186 2/0/1 CNAME telemetry-incoming.r53-2.services.mozilla.com., A 34.120.208.123 (134)
12:10:28.131818 IP _gateway.domain > 192.168.70.197.59292: 63189 1/1/1 CNAME telemetry-incoming.r53-2.services.mozilla.com. (197)
12:10:28.134364 IP 192.168.70.197.49262 > _gateway.domain: 34929+ [1au] AAAA? telemetry-incoming.r53-2.services.mozilla.com. (74)
12:10:28.137507 IP 192.168.70.197.36106 > 34.120.208.123.https: Flags [S], seq 161283197, win 64240, options [mss 1460,sackOK,TS val 4075038413 ecr 0,nop,wscale 7], length 0
12:10:28.245707 IP 192.168.70.197.46806 > 34.117.188.166.https: Flags [S], seq 1810427549, win 64240, options [mss 1460,sackOK,TS val 4113560736 ecr 0,nop,wscale 7], length 0
12:10:28.283734 IP 192.168.70.197.53388 > 34.149.97.1.https: Flags [S], seq 51318473, win 64240, options [mss 1460,sackOK,TS val 2300060920 ecr 0,nop,wscale 7], length 0
12:10:28.370687 IP 192.168.70.197.46810 > 34.117.188.166.https: Flags [S], seq 955551563, win 64240, options [mss 1460,sackOK,TS val 4113560862 ecr 0,nop,wscale 7], length 0
12:10:28.388863 IP 192.168.70.197.36112 > 34.120.208.123.https: Flags [S], seq 2308565288, win 64240, options [mss 1460,sackOK,TS val 4075038665 ecr 0,nop,wscale 7], length 0
12:10:28.442081 IP 192.168.70.197.59914 > 67.220.226.172.https: Flags [S], seq 3479552367, win 64240, options [mss 1460,sackOK,TS val 3289941403 ecr 0,nop,wscale 7], length 0
12:10:28.695971 IP 192.168.70.197.59930 > 67.220.226.172.https: Flags [S], seq 4155836079, win 64240, options [mss 1460,sackOK,TS val 3289941657 ecr 0,nop,wscale 7], length 0
12:10:28.982291 IP 192.168.70.197.53372 > 34.149.97.1.https: Flags [S], seq 2800748576, win 64240, options [mss 1460,sackOK,TS val 2300061618 ecr 0,nop,wscale 7], length 0
12:10:28.983821 IP 192.168.70.197.46784 > 34.117.188.166.https: Flags [S], seq 4061586300, win 64240, options [mss 1460,sackOK,TS val 4113561474 ecr 0,nop,wscale 7], length 0
12:10:29.026074 IP _gateway.domain > 192.168.70.197.49479: 13169 0/1/1 (158)
12:10:29.110342 IP 192.168.70.197.46798 > 34.117.188.166.https: Flags [S], seq 3946425765, win 64240, options [mss 1460,sackOK,TS val 4113561601 ecr 0,nop,wscale 7], length 0
12:10:29.151801 IP 192.168.70.197.36106 > 34.120.208.123.https: Flags [S], seq 161283197, win 64240, options [mss 1460,sackOK,TS val 4075039428 ecr 0,nop,wscale 7], length 0
12:10:29.174190 IP 192.168.70.197.58026 > 2.22.220.225.https: Flags [FP.], seq 0:102, ack 1, win 501, options [nop,nop,TS val 2698423035 ecr 291928479], length 102
12:10:29.269976 IP 192.168.70.197.46806 > 34.117.188.166.https: Flags [S], seq 1810427549, win 64240, options [mss 1460,sackOK,TS val 4113561761 ecr 0,nop,wscale 7], length 0
12:10:29.293692 IP 192.168.70.197.59938 > 67.220.226.172.https: Flags [S], seq 2577544630, win 64240, options [mss 1460,sackOK,TS val 3289942254 ecr 0,nop,wscale 7], length 0
12:10:29.302880 IP 192.168.70.197.53388 > 34.149.97.1.https: Flags [S], seq 51318473, win 64240, options [mss 1460,sackOK,TS val 2300061939 ecr 0,nop,wscale 7], length 0
12:10:29.328756 IP _gateway.domain > 192.168.70.197.49262: 34929 0/1/1 (156)
12:10:29.397848 IP 192.168.70.197.36112 > 34.120.208.123.https: Flags [S], seq 2308565288, win 64240, options [mss 1460,sackOK,TS val 4075039674 ecr 0,nop,wscale 7], length 0
12:10:29.397849 IP 192.168.70.197.46810 > 34.117.188.166.https: Flags [S], seq 955551563, win 64240, options [mss 1460,sackOK,TS val 4113561889 ecr 0,nop,wscale 7], length 0
12:10:29.466819 IP 192.168.70.197.59914 > 67.220.226.172.https: Flags [S], seq 3479552367, win 64240, options [mss 1460,sackOK,TS val 3289942428 ecr 0,nop,wscale 7], length 0
12:10:29.548860 IP 192.168.70.197.59954 > 67.220.226.172.https: Flags [S], seq 1315695479, win 64240, options [mss 1460,sackOK,TS val 3289942510 ecr 0,nop,wscale 7], length 0
12:10:29.718134 IP 192.168.70.197.59930 > 67.220.226.172.https: Flags [S], seq 4155836079, win 64240, options [mss 1460,sackOK,TS val 3289942679 ecr 0,nop,wscale 7], length 0
12:10:30.006629 IP 192.168.70.197.46784 > 34.117.188.166.https: Flags [S], seq 4061586300, win 64240, options [mss 1460,sackOK,TS val 4113562498 ecr 0,nop,wscale 7], length 0
12:10:30.009092 IP 192.168.70.197.53372 > 34.149.97.1.https: Flags [S], seq 2800748576, win 64240, options [mss 1460,sackOK,TS val 2300062643 ecr 0,nop,wscale 7], length 0
12:10:30.134014 IP 192.168.70.197.46798 > 34.117.188.166.https: Flags [S], seq 3946425765, win 64240, options [mss 1460,sackOK,TS val 4113562625 ecr 0,nop,wscale 7], length 0
12:10:30.177800 IP 192.168.70.197.36106 > 34.120.208.123.https: Flags [S], seq 161283197, win 64240, options [mss 1460,sackOK,TS val 4075040454 ecr 0,nop,wscale 7], length 0
12:10:30.302035 IP 192.168.70.197.46806 > 34.117.188.166.https: Flags [S], seq 1810427549, win 64240, options [mss 1460,sackOK,TS val 4113562793 ecr 0,nop,wscale 7], length 0
12:10:30.326069 IP 192.168.70.197.53388 > 34.149.97.1.https: Flags [S], seq 51318473, win 64240, options [mss 1460,sackOK,TS val 2300062962 ecr 0,nop,wscale 7], length 0
12:10:30.327324 IP 192.168.70.197.59938 > 67.220.226.172.https: Flags [S], seq 2577544630, win 64240, options [mss 1460,sackOK,TS val 3289943288 ecr 0,nop,wscale 7], length 0
12:10:30.389426 IP 192.168.70.197.59620 > _gateway.domain: 62793+ [1au] A? firefox-api-proxy.cdn.mozilla.net. (62)
12:10:30.430828 IP 192.168.70.197.46810 > 34.117.188.166.https: Flags [S], seq 955551563, win 64240, options [mss 1460,sackOK,TS val 4113562922 ecr 0,nop,wscale 7], length 0
12:10:30.432100 IP 192.168.70.197.36112 > 34.120.208.123.https: Flags [S], seq 2308565288, win 64240, options [mss 1460,sackOK,TS val 4075040707 ecr 0,nop,wscale 7], length 0
12:10:30.494618 IP 192.168.70.197.59914 > 67.220.226.172.https: Flags [S], seq 3479552367, win 64240, options [mss 1460,sackOK,TS val 3289943456 ecr 0,nop,wscale 7], length 0
12:10:30.524475 IP _gateway.domain > 192.168.70.197.59620: 62793 2/0/1 CNAME firefox-api-proxy-prod.pocket.prod.cloudops.mozgcp.net., A 34.149.97.1 (143)
12:10:30.528006 IP 192.168.70.197.56516 > _gateway.domain: 4883+ [1au] AAAA? firefox-api-proxy-prod.pocket.prod.cloudops.mozgcp.net. (83)
12:10:30.582803 IP 192.168.70.197.59954 > 67.220.226.172.https: Flags [S], seq 1315695479, win 64240, options [mss 1460,sackOK,TS val 3289943544 ecr 0,nop,wscale 7], length 0
12:10:30.685682 IP _gateway.domain > 192.168.70.197.56516: 4883 0/0/1 (83)
12:10:30.687056 IP 192.168.70.197.45529 > _gateway.domain: 35764+ [1au] A? c.go-mpulse.net. (44)
12:10:30.730208 IP _gateway.domain > 192.168.70.197.45529: 35764 3/0/1 CNAME wildcard46.go-mpulse.net.edgekey.net., CNAME e4518.dscapi7.akamaiedge.net., A 23.213.44.142 (146)
12:10:30.741205 IP 192.168.70.197.33367 > _gateway.domain: 1986+ [1au] AAAA? e4518.dscapi7.akamaiedge.net. (57)
12:10:30.742167 IP 192.168.70.197.59930 > 67.220.226.172.https: Flags [S], seq 4155836079, win 64240, options [mss 1460,sackOK,TS val 3289943703 ecr 0,nop,wscale 7], length 0
12:10:30.806133 IP _gateway.domain > 192.168.70.197.33367: 1986 0/0/1 (57)
12:10:31.037753 IP 192.168.70.197.53372 > 34.149.97.1.https: Flags [S], seq 2800748576, win 64240, options [mss 1460,sackOK,TS val 2300063674 ecr 0,nop,wscale 7], length 0
12:10:31.037753 IP 192.168.70.197.46784 > 34.117.188.166.https: Flags [S], seq 4061586300, win 64240, options [mss 1460,sackOK,TS val 4113563529 ecr 0,nop,wscale 7], length 0
12:10:31.166688 IP 192.168.70.197.46798 > 34.117.188.166.https: Flags [S], seq 3946425765, win 64240, options [mss 1460,sackOK,TS val 4113563658 ecr 0,nop,wscale 7], length 0
12:10:31.198433 IP 192.168.70.197.36106 > 34.120.208.123.https: Flags [S], seq 161283197, win 64240, options [mss 1460,sackOK,TS val 4075041474 ecr 0,nop,wscale 7], length 0
12:10:31.317865 IP 192.168.70.197.46806 > 34.117.188.166.https: Flags [S], seq 1810427549, win 64240, options [mss 1460,sackOK,TS val 4113563809 ecr 0,nop,wscale 7], length 0
12:10:31.359177 IP 192.168.70.197.59938 > 67.220.226.172.https: Flags [S], seq 2577544630, win 64240, options [mss 1460,sackOK,TS val 3289944320 ecr 0,nop,wscale 7], length 0
12:10:31.360530 IP 192.168.70.197.53388 > 34.149.97.1.https: Flags [S], seq 51318473, win 64240, options [mss 1460,sackOK,TS val 2300063996 ecr 0,nop,wscale 7], length 0
12:10:31.454962 IP 192.168.70.197.36112 > 34.120.208.123.https: Flags [S], seq 2308565288, win 64240, options [mss 1460,sackOK,TS val 4075041731 ecr 0,nop,wscale 7], length 0
12:10:31.455862 IP 192.168.70.197.46810 > 34.117.188.166.https: Flags [S], seq 955551563, win 64240, options [mss 1460,sackOK,TS val 4113563946 ecr 0,nop,wscale 7], length 0
12:10:31.509817 IP 192.168.70.197.59914 > 67.220.226.172.https: Flags [S], seq 3479552367, win 64240, options [mss 1460,sackOK,TS val 3289944471 ecr 0,nop,wscale 7], length 0
12:10:31.605824 IP 192.168.70.197.59954 > 67.220.226.172.https: Flags [S], seq 1315695479, win 64240, options [mss 1460,sackOK,TS val 3289944567 ecr 0,nop,wscale 7], length 0
12:10:31.766163 IP 192.168.70.197.59930 > 67.220.226.172.https: Flags [S], seq 4155836079, win 64240, options [mss 1460,sackOK,TS val 3289944727 ecr 0,nop,wscale 7], length 0
12:10:32.053785 IP 192.168.70.197.46784 > 34.117.188.166.https: Flags [S], seq 4061586300, win 64240, options [mss 1460,sackOK,TS val 4113564545 ecr 0,nop,wscale 7], length 0
12:10:32.053785 IP 192.168.70.197.53372 > 34.149.97.1.https: Flags [S], seq 2800748576, win 64240, options [mss 1460,sackOK,TS val 2300064690 ecr 0,nop,wscale 7], length 0
12:10:32.190748 IP 192.168.70.197.46798 > 34.117.188.166.https: Flags [S], seq 3946425765, win 64240, options [mss 1460,sackOK,TS val 4113564682 ecr 0,nop,wscale 7], length 0
12:10:32.215323 IP 192.168.70.197.59968 > 67.220.226.172.https: Flags [S], seq 2115300797, win 64240, options [mss 1460,sackOK,TS val 3289945176 ecr 0,nop,wscale 7], length 0
12:10:32.216464 IP 192.168.70.197.36106 > 34.120.208.123.https: Flags [S], seq 161283197, win 64240, options [mss 1460,sackOK,TS val 4075042492 ecr 0,nop,wscale 7], length 0
12:10:32.351253 IP 192.168.70.197.46806 > 34.117.188.166.https: Flags [S], seq 1810427549, win 64240, options [mss 1460,sackOK,TS val 4113564842 ecr 0,nop,wscale 7], length 0
12:10:32.383605 IP 192.168.70.197.53388 > 34.149.97.1.https: Flags [S], seq 51318473, win 64240, options [mss 1460,sackOK,TS val 2300065020 ecr 0,nop,wscale 7], length 0
12:10:32.384509 IP 192.168.70.197.59938 > 67.220.226.172.https: Flags [S], seq 2577544630, win 64240, options [mss 1460,sackOK,TS val 3289945345 ecr 0,nop,wscale 7], length 0
12:10:32.469862 IP 192.168.70.197.46810 > 34.117.188.166.https: Flags [S], seq 955551563, win 64240, options [mss 1460,sackOK,TS val 4113564961 ecr 0,nop,wscale 7], length 0
12:10:32.469863 IP 192.168.70.197.36112 > 34.120.208.123.https: Flags [S], seq 2308565288, win 64240, options [mss 1460,sackOK,TS val 4075042746 ecr 0,nop,wscale 7], length 0
12:10:32.471308 IP 192.168.70.197.59972 > 67.220.226.172.https: Flags [S], seq 3343949293, win 64240, options [mss 1460,sackOK,TS val 3289945432 ecr 0,nop,wscale 7], length 0
12:10:32.534102 IP 192.168.70.197.59914 > 67.220.226.172.https: Flags [S], seq 3479552367, win 64240, options [mss 1460,sackOK,TS val 3289945495 ecr 0,nop,wscale 7], length 0
12:10:32.637763 IP 192.168.70.197.59954 > 67.220.226.172.https: Flags [S], seq 1315695479, win 64240, options [mss 1460,sackOK,TS val 3289945599 ecr 0,nop,wscale 7], length 0
12:10:33.084679 IP 192.168.70.197.53372 > 34.149.97.1.https: Flags [S], seq 2800748576, win 64240, options [mss 1460,sackOK,TS val 2300065721 ecr 0,nop,wscale 7], length 0
12:10:33.084679 IP 192.168.70.197.46784 > 34.117.188.166.https: Flags [S], seq 4061586300, win 64240, options [mss 1460,sackOK,TS val 4113565576 ecr 0,nop,wscale 7], length 0
12:10:33.209884 IP 192.168.70.197.46798 > 34.117.188.166.https: Flags [S], seq 3946425765, win 64240, options [mss 1460,sackOK,TS val 4113565701 ecr 0,nop,wscale 7], length 0
12:10:33.240044 IP 192.168.70.197.59968 > 67.220.226.172.https: Flags [S], seq 2115300797, win 64240, options [mss 1460,sackOK,TS val 3289946201 ecr 0,nop,wscale 7], length 0
12:10:33.241078 IP 192.168.70.197.36106 > 34.120.208.123.https: Flags [S], seq 161283197, win 64240, options [mss 1460,sackOK,TS val 4075043516 ecr 0,nop,wscale 7], length 0
12:10:33.398639 IP 192.168.70.197.59938 > 67.220.226.172.https: Flags [S], seq 2577544630, win 64240, options [mss 1460,sackOK,TS val 3289946360 ecr 0,nop,wscale 7], length 0
12:10:33.494426 IP 192.168.70.197.59972 > 67.220.226.172.https: Flags [S], seq 3343949293, win 64240, options [mss 1460,sackOK,TS val 3289946456 ecr 0,nop,wscale 7], length 0
12:10:33.654842 IP 192.168.70.197.59954 > 67.220.226.172.https: Flags [S], seq 1315695479, win 64240, options [mss 1460,sackOK,TS val 3289946616 ecr 0,nop,wscale 7], length 0
12:10:34.014116 IP 192.168.70.197.41363 > _gateway.domain: 10600+ [1au] A? fls-eu.amazon.es. (45)
12:10:34.015484 IP 192.168.70.197.37362 > _gateway.domain: 59131+ [1au] AAAA? fls-eu.amazon.es. (45)
12:10:34.018859 IP 192.168.70.197.43906 > 52.214.250.165.https: Flags [S], seq 4112410930, win 64240, options [mss 1460,sackOK,TS val 462220574 ecr 0,nop,wscale 7], length 0
12:10:34.081999 IP _gateway.domain > 192.168.70.197.41363: 10600 11/0/1 CNAME fls-eu.amazon.com., CNAME gateway.prod.eu-west-1.forester.a2z.com., CNAME endpoint.prod.eu-west-1.forester.a2z.com., A 54.72.95.106, A 52.51.119.157, A 108.128.46.66, A 52.208.157.171, A 18.202.191.18, A 34.250.118.167, A 52.211.147.21, A 34.251.188.153 (277)
12:10:34.082362 IP _gateway.domain > 192.168.70.197.37362: 59131 3/1/1 CNAME fls-eu.amazon.com., CNAME gateway.prod.eu-west-1.forester.a2z.com., CNAME endpoint.prod.eu-west-1.forester.a2z.com. (223)
12:10:34.084696 IP 192.168.70.197.42457 > _gateway.domain: 58581+ [1au] AAAA? endpoint.prod.eu-west-1.forester.a2z.com. (69)
12:10:34.183092 IP _gateway.domain > 192.168.70.197.42457: 58581 0/1/1 (150)
12:10:34.261911 IP 192.168.70.197.59968 > 67.220.226.172.https: Flags [S], seq 2115300797, win 64240, options [mss 1460,sackOK,TS val 3289947223 ecr 0,nop,wscale 7], length 0
12:10:34.270039 IP 192.168.70.197.48638 > 54.72.95.106.https: Flags [S], seq 2312859882, win 64240, options [mss 1460,sackOK,TS val 1886552546 ecr 0,nop,wscale 7], length 0
12:10:34.421875 IP 192.168.70.197.59938 > 67.220.226.172.https: Flags [S], seq 2577544630, win 64240, options [mss 1460,sackOK,TS val 3289947383 ecr 0,nop,wscale 7], length 0
12:10:34.517803 IP 192.168.70.197.59972 > 67.220.226.172.https: Flags [S], seq 3343949293, win 64240, options [mss 1460,sackOK,TS val 3289947479 ecr 0,nop,wscale 7], length 0
12:10:34.549883 IP 192.168.70.197.59914 > 67.220.226.172.https: Flags [S], seq 3479552367, win 64240, options [mss 1460,sackOK,TS val 3289947511 ecr 0,nop,wscale 7], length 0
12:10:35.030519 IP 192.168.70.197.43906 > 52.214.250.165.https: Flags [S], seq 4112410930, win 64240, options [mss 1460,sackOK,TS val 462221586 ecr 0,nop,wscale 7], length 0
12:10:42.741995 IP 192.168.70.197.53222 > 52.214.174.28.https: Flags [P.], seq 0:106, ack 1, win 501, options [nop,nop,TS val 3876929121 ecr 2955270021], length 106
12:10:42.869703 IP 192.168.70.197.58968 > 34.120.208.123.https: Flags [S], seq 4209853202, win 64240, options [mss 1460,sackOK,TS val 4075053146 ecr 0,nop,wscale 7], length 0
12:10:43.093927 IP 192.168.70.197.58970 > 34.120.208.123.https: Flags [S], seq 1176656938, win 64240, options [mss 1460,sackOK,TS val 4075053370 ecr 0,nop,wscale 7], length 0
12:10:43.350631 IP 192.168.70.197.47332 > 108.128.46.66.https: Flags [S], seq 3162509463, win 64240, options [mss 1460,sackOK,TS val 2188025398 ecr 0,nop,wscale 7], length 0
12:10:43.510081 IP 192.168.70.197.59968 > 67.220.226.172.https: Flags [S], seq 2115300797, win 64240, options [mss 1460,sackOK,TS val 3289956471 ecr 0,nop,wscale 7], length 0
12:11:12.463813 IP 192.168.70.197.38738 > 34.120.208.123.https: Flags [S], seq 1922166519, win 64240, options [mss 1460,sackOK,TS val 4075082740 ecr 0,nop,wscale 7], length 0
12:11:13.018001 IP 192.168.70.197.51100 > _gateway.domain: 42830+ [1au] AAAA? elpais.com. (39)
12:11:13.019109 IP 192.168.70.197.37265 > _gateway.domain: 57225+ [1au] A? elpais.com. (39)
12:11:13.019946 IP 192.168.70.197.35558 > _gateway.domain: 27702+ [1au] A? motor.elpais.com. (45)
12:11:13.019946 IP 192.168.70.197.41637 > _gateway.domain: 24198+ [1au] AAAA? motor.elpais.com. (45)
12:11:13.021806 IP 192.168.70.197.35964 > _gateway.domain: 11738+ [1au] AAAA? contile.services.mozilla.com. (57)
12:11:13.026495 IP 192.168.70.197.38605 > _gateway.domain: 58092+ [1au] AAAA? www.eleconomista.es. (48)
12:11:13.027321 IP 192.168.70.197.54675 > _gateway.domain: 56465+ [1au] AAAA? www.revistavanityfair.es. (53)
12:11:13.028056 IP 192.168.70.197.34419 > _gateway.domain: 18238+ [1au] A? www.revistavanityfair.es. (53)
12:11:13.029160 IP 192.168.70.197.37724 > _gateway.domain: 58919+ [1au] A? www.eleconomista.es. (48)
12:11:13.035106 IP 192.168.70.197.56126 > _gateway.domain: 30684+ [1au] AAAA? aec01.esg.edgetcdn.io. (50)
12:11:13.054139 IP 192.168.70.197.42809 > _gateway.domain: 20203+ [1au] A? www.muyinteresante.com. (51)
12:11:13.054139 IP 192.168.70.197.38127 > _gateway.domain: 26885+ [1au] A? maldita.es. (39)
12:11:13.055350 IP 192.168.70.197.49407 > _gateway.domain: 58998+ [1au] A? cnnespanol.cnn.com. (47)
12:11:13.055350 IP 192.168.70.197.52183 > _gateway.domain: 56797+ [1au] AAAA? www.lavanguardia.com. (49)
12:11:13.055350 IP 192.168.70.197.50143 > _gateway.domain: 11557+ [1au] A? es.wired.com. (41)
12:11:13.056259 IP 192.168.70.197.47033 > _gateway.domain: 63113+ [1au] A? www.lavanguardia.com. (49)
12:11:13.056260 IP 192.168.70.197.42931 > _gateway.domain: 40565+ [1au] AAAA? cnnespanol.cnn.com. (47)
12:11:13.058019 IP 192.168.70.197.40796 > _gateway.domain: 8859+ [1au] AAAA? es.wired.com. (41)
12:11:13.058020 IP 192.168.70.197.45643 > _gateway.domain: 28989+ [1au] AAAA? www.womenshealthmag.com. (52)
12:11:13.058020 IP 192.168.70.197.53554 > _gateway.domain: 7089+ [1au] A? www.womenshealthmag.com. (52)
12:11:13.059119 IP 192.168.70.197.51694 > _gateway.domain: 64622+ [1au] A? condenast.map.fastly.net. (53)
12:11:13.059120 IP 192.168.70.197.49042 > _gateway.domain: 32140+ [1au] A? www.abc.es. (39)
12:11:13.059911 IP 192.168.70.197.47197 > _gateway.domain: 9238+ [1au] A? www.nike.com. (41)
12:11:13.060743 IP 192.168.70.197.35440 > _gateway.domain: 45459+ [1au] A? e11235.dsca.akamaiedge.net. (55)
12:11:13.060743 IP 192.168.70.197.57355 > _gateway.domain: 33616+ [1au] A? www.transfernow.net. (48)
12:11:13.061810 IP 192.168.70.197.53953 > _gateway.domain: 33606+ [1au] AAAA? www.nike.com. (41)
12:11:13.066908 IP 192.168.70.197.54632 > _gateway.domain: 17729+ [1au] AAAA? maldita.es. (39)
12:11:13.221841 IP _gateway.domain > 192.168.70.197.37265: 57225 3/0/1 A 77.209.227.80, A 77.209.227.83, A 46.24.126.88 (87)
12:11:13.223499 IP _gateway.domain > 192.168.70.197.35558: 27702 4/0/1 A 108.157.109.5, A 108.157.109.47, A 108.157.109.49, A 108.157.109.110 (109)
12:11:13.227788 IP _gateway.domain > 192.168.70.197.41637: 24198 0/1/1 (127)
12:11:13.228757 IP _gateway.domain > 192.168.70.197.35964: 11738 0/1/1 (138)
12:11:13.231351 IP _gateway.domain > 192.168.70.197.38605: 58092 2/0/1 CNAME ecoprensa.edgesuite.net., CNAME a1933.dscr.akamai.net. (117)
12:11:13.233242 IP 192.168.70.197.56666 > _gateway.domain: 17786+ [1au] AAAA? a1933.dscr.akamai.net. (50)
12:11:13.235250 IP _gateway.domain > 192.168.70.197.34419: 18238 4/0/1 A 18.67.240.80, A 18.67.240.27, A 18.67.240.113, A 18.67.240.47 (117)
12:11:13.237953 IP 192.168.70.197.38726 > 34.120.208.123.https: Flags [S], seq 1849879058, win 64240, options [mss 1460,sackOK,TS val 4075083514 ecr 0,nop,wscale 7], length 0
12:11:13.238686 IP _gateway.domain > 192.168.70.197.37724: 58919 4/0/1 CNAME ecoprensa.edgesuite.net., CNAME a1933.dscr.akamai.net., A 77.209.227.88, A 77.209.227.113 (149)
12:11:13.251705 IP _gateway.domain > 192.168.70.197.42809: 20203 12/0/1 CNAME caching.c327.edge2befaster.net., CNAME aec01.esc.edgetcdn.net., CNAME aec01.esg.edgetcdn.net., A 185.103.37.76, A 185.103.37.77, A 185.103.37.75, A 185.103.37.72, A 185.103.37.74, A 185.57.173.171, A 185.57.173.172, A 185.76.11.193, A 185.103.37.73 (296)
12:11:13.251964 IP _gateway.domain > 192.168.70.197.38127: 26885 3/0/1 A 104.22.22.189, A 172.67.13.51, A 104.22.23.189 (87)
12:11:13.253856 IP _gateway.domain > 192.168.70.197.49407: 58998 2/0/1 CNAME cnn-tls.map.fastly.net., A 151.101.135.5 (99)
12:11:13.254892 IP _gateway.domain > 192.168.70.197.52183: 56797 2/1/1 CNAME www.lavanguardia.com.edgekey.net., CNAME e4628.f.akamaiedge.net. (186)
12:11:13.256139 IP 192.168.70.197.39116 > _gateway.domain: 4179+ [1au] AAAA? aec01.esg.edgetcdn.net. (51)
12:11:13.257409 IP _gateway.domain > 192.168.70.197.56126: 30684 0/0/1 (50)
12:11:13.257850 IP 192.168.70.197.45992 > _gateway.domain: 9058+ [1au] AAAA? e4628.f.akamaiedge.net. (51)
12:11:13.258931 IP _gateway.domain > 192.168.70.197.50143: 11557 4/0/1 A 18.154.22.4, A 18.154.22.109, A 18.154.22.57, A 18.154.22.27 (105)
12:11:13.262570 IP _gateway.domain > 192.168.70.197.47033: 63113 3/0/1 CNAME www.lavanguardia.com.edgekey.net., CNAME e4628.f.akamaiedge.net., A 23.10.76.220 (144)
12:11:13.316115 IP _gateway.domain > 192.168.70.197.45643: 28989 1/1/1 CNAME hearst-hdm.map.fastly.net. (149)
12:11:13.316824 IP _gateway.domain > 192.168.70.197.49042: 32140 6/0/1 CNAME abc.edgekey.net., CNAME e15414.a.akamaiedge.net., A 23.200.66.142, A 23.200.66.147, A 23.200.66.157, A 23.200.66.150 (166)
12:11:13.317883 IP _gateway.domain > 192.168.70.197.47197: 9238 6/0/1 CNAME www-geo.nike.com.akadns.net., CNAME www.nike.com.akadns.net., CNAME ev-cn.nike.com.edgekey.net., CNAME ev-cn.nike.com.edgekey.net.globalredir.akadns.net., CNAME e2785.x.akamaiedge.net., A 23.62.188.83 (239)
12:11:13.318093 IP _gateway.domain > 192.168.70.197.35440: 45459 1/0/1 A 2.21.141.134 (71)
12:11:13.318500 IP 192.168.70.197.58745 > _gateway.domain: 16918+ [1au] AAAA? hearst-hdm.map.fastly.net. (54)
12:11:13.320295 IP 192.168.70.197.50885 > _gateway.domain: 33161+ [1au] AAAA? e15414.a.akamaiedge.net. (52)
12:11:13.322479 IP 192.168.70.197.42888 > _gateway.domain: 52441+ [1au] AAAA? e11235.dsca.akamaiedge.net. (55)
12:11:13.329673 IP _gateway.domain > 192.168.70.197.53953: 33606 5/1/1 CNAME www-geo.nike.com.akadns.net., CNAME www.nike.com.akadns.net., CNAME ev-cn.nike.com.edgekey.net., CNAME ev-cn.nike.com.edgekey.net.globalredir.akadns.net., CNAME e2785.x.akamaiedge.net. (281)
12:11:13.329915 IP _gateway.domain > 192.168.70.197.54632: 17729 0/1/1 (101)
12:11:13.329975 IP _gateway.domain > 192.168.70.197.45992: 9058 0/1/1 (112)
12:11:13.330029 IP _gateway.domain > 192.168.70.197.51694: 64622 1/0/1 A 151.101.132.239 (69)
12:11:13.330083 IP _gateway.domain > 192.168.70.197.53554: 7089 2/0/1 CNAME hearst-hdm.map.fastly.net., A 151.101.132.155 (107)
12:11:13.333827 IP _gateway.domain > 192.168.70.197.54675: 56465 0/0/1 (53)
12:11:13.334295 IP 192.168.70.197.33489 > _gateway.domain: 3303+ [1au] AAAA? e2785.x.akamaiedge.net. (51)
12:11:13.334678 IP _gateway.domain > 192.168.70.197.57355: 33616 3/0/1 A 172.67.72.33, A 104.26.14.166, A 104.26.15.166 (96)
12:11:13.337085 IP 192.168.70.197.50687 > _gateway.domain: 55048+ [1au] AAAA? www.revistaad.es. (45)
12:11:13.338395 IP _gateway.domain > 192.168.70.197.42931: 40565 1/0/1 CNAME cnn-tls.map.fastly.net. (83)
12:11:13.339095 IP 192.168.70.197.54338 > _gateway.domain: 47804+ [1au] AAAA? www.transfernow.net. (48)
12:11:13.339642 IP _gateway.domain > 192.168.70.197.40796: 8859 0/0/1 (41)
12:11:13.340101 IP 192.168.70.197.37893 > _gateway.domain: 9472+ [1au] AAAA? cnn-tls.map.fastly.net. (51)
12:11:13.342001 IP _gateway.domain > 192.168.70.197.58745: 16918 0/1/1 (115)
12:11:13.343303 IP _gateway.domain > 192.168.70.197.50885: 33161 0/1/1 (113)
12:11:13.345391 IP _gateway.domain > 192.168.70.197.33489: 3303 0/1/1 (112)
12:11:13.348364 IP 192.168.70.197.56664 > 23.62.188.83.https: Flags [S], seq 293513611, win 64240, options [mss 1460,sackOK,TS val 398007398 ecr 0,nop,wscale 7], length 0
12:11:13.356548 IP _gateway.domain > 192.168.70.197.39116: 4179 0/0/1 (51)
12:11:13.357303 IP _gateway.domain > 192.168.70.197.56666: 17786 0/0/1 (50)
12:11:13.363360 IP _gateway.domain > 192.168.70.197.50687: 55048 1/1/1 CNAME condenast.map.fastly.net. (144)
12:11:13.364668 IP 192.168.70.197.46329 > _gateway.domain: 19702+ [1au] AAAA? condenast.map.fastly.net. (53)
12:11:13.373146 IP _gateway.domain > 192.168.70.197.42888: 52441 0/0/1 (55)
12:11:13.378678 IP _gateway.domain > 192.168.70.197.46329: 19702 0/1/1 (114)
12:11:13.384447 IP _gateway.domain > 192.168.70.197.54338: 47804 0/0/1 (48)
12:11:13.385139 IP _gateway.domain > 192.168.70.197.37893: 9472 0/0/1 (51)
12:11:13.501127 IP 192.168.70.197.38738 > 34.120.208.123.https: Flags [S], seq 1922166519, win 64240, options [mss 1460,sackOK,TS val 4075083778 ecr 0,nop,wscale 7], length 0
12:11:13.601799 IP 192.168.70.197.56674 > 23.62.188.83.https: Flags [S], seq 626290239, win 64240, options [mss 1460,sackOK,TS val 398007651 ecr 0,nop,wscale 7], length 0
12:11:14.261729 IP 192.168.70.197.38726 > 34.120.208.123.https: Flags [S], seq 1849879058, win 64240, options [mss 1460,sackOK,TS val 4075084538 ecr 0,nop,wscale 7], length 0
12:11:14.362496 IP 192.168.70.197.56664 > 23.62.188.83.https: Flags [S], seq 293513611, win 64240, options [mss 1460,sackOK,TS val 398008412 ecr 0,nop,wscale 7], length 0
12:11:14.524286 IP 192.168.70.197.38738 > 34.120.208.123.https: Flags [S], seq 1922166519, win 64240, options [mss 1460,sackOK,TS val 4075084800 ecr 0,nop,wscale 7], length 0
12:11:14.619673 IP 192.168.70.197.56674 > 23.62.188.83.https: Flags [S], seq 626290239, win 64240, options [mss 1460,sackOK,TS val 398008669 ecr 0,nop,wscale 7], length 0
12:11:15.287340 IP 192.168.70.197.38726 > 34.120.208.123.https: Flags [S], seq 1849879058, win 64240, options [mss 1460,sackOK,TS val 4075085564 ecr 0,nop,wscale 7], length 0
12:11:15.390258 IP 192.168.70.197.56664 > 23.62.188.83.https: Flags [S], seq 293513611, win 64240, options [mss 1460,sackOK,TS val 398009440 ecr 0,nop,wscale 7], length 0
12:11:15.545697 IP 192.168.70.197.38738 > 34.120.208.123.https: Flags [S], seq 1922166519, win 64240, options [mss 1460,sackOK,TS val 4075085822 ecr 0,nop,wscale 7], length 0
12:11:15.642969 IP 192.168.70.197.56674 > 23.62.188.83.https: Flags [S], seq 626290239, win 64240, options [mss 1460,sackOK,TS val 398009693 ecr 0,nop,wscale 7], length 0
12:11:15.769994 IP 192.168.70.197.56122 > 34.36.165.17.https: Flags [S], seq 1562223418, win 64240, options [mss 1460,sackOK,TS val 3482604971 ecr 0,nop,wscale 7], length 0
12:11:16.314924 IP 192.168.70.197.38726 > 34.120.208.123.https: Flags [S], seq 1849879058, win 64240, options [mss 1460,sackOK,TS val 4075086591 ecr 0,nop,wscale 7], length 0
12:11:16.413542 IP 192.168.70.197.56664 > 23.62.188.83.https: Flags [S], seq 293513611, win 64240, options [mss 1460,sackOK,TS val 398010463 ecr 0,nop,wscale 7], length 0
12:11:16.507047 IP 192.168.70.197.36552 > 192.168.110.156.http: Flags [S], seq 221921321, win 64240, options [mss 1460,sackOK,TS val 1781033270 ecr 0,nop,wscale 7], length 0
12:11:16.508124 IP 192.168.110.156.http > 192.168.70.197.36552: Flags [S.], seq 4063067273, ack 221921322, win 65160, options [mss 1460,sackOK,TS val 3189763416 ecr 1781033270,nop,wscale 7], length 0
12:11:16.510711 IP 192.168.70.197.36552 > 192.168.110.156.http: Flags [.], ack 1, win 502, options [nop,nop,TS val 1781033273 ecr 3189763416], length 0
12:11:16.513762 IP 192.168.70.197.36552 > 192.168.110.156.http: Flags [P.], seq 1:486, ack 1, win 502, options [nop,nop,TS val 1781033276 ecr 3189763416], length 485: HTTP: GET /owncloud/owncloud/status.php HTTP/1.1
12:11:16.514583 IP 192.168.110.156.http > 192.168.70.197.36552: Flags [.], ack 486, win 506, options [nop,nop,TS val 3189763422 ecr 1781033276], length 0
12:11:16.515557 IP 192.168.110.156.http > 192.168.70.197.36552: Flags [P.], seq 1:551, ack 486, win 506, options [nop,nop,TS val 3189763423 ecr 1781033276], length 550: HTTP: HTTP/1.1 302 Found
12:11:16.516783 IP 192.168.70.197.36552 > 192.168.110.156.http: Flags [.], ack 551, win 501, options [nop,nop,TS val 1781033279 ecr 3189763423], length 0
12:11:16.518018 IP 192.168.70.197.55898 > helena.http: Flags [S], seq 50423374, win 64240, options [mss 1460,sackOK,TS val 1598359592 ecr 0,nop,wscale 7], length 0
12:11:16.518727 IP helena.http > 192.168.70.197.55898: Flags [S.], seq 1087658004, ack 50423375, win 65160, options [mss 1460,sackOK,TS val 3189763426 ecr 1598359592,nop,wscale 7], length 0
12:11:16.519483 IP 192.168.70.197.55898 > helena.http: Flags [.], ack 1, win 502, options [nop,nop,TS val 1598359593 ecr 3189763426], length 0
12:11:16.520146 IP 192.168.70.197.55898 > helena.http: Flags [P.], seq 1:465, ack 1, win 502, options [nop,nop,TS val 1598359594 ecr 3189763426], length 464: HTTP: GET /index.php HTTP/1.1
12:11:16.520932 IP helena.http > 192.168.70.197.55898: Flags [.], ack 465, win 506, options [nop,nop,TS val 3189763428 ecr 1598359594], length 0
12:11:16.536291 IP helena.http > 192.168.70.197.55898: Flags [P.], seq 1:705, ack 465, win 506, options [nop,nop,TS val 3189763444 ecr 1598359594], length 704: HTTP: HTTP/1.1 200 OK
12:11:16.537659 IP 192.168.70.197.55898 > helena.http: Flags [.], ack 705, win 501, options [nop,nop,TS val 1598359611 ecr 3189763444], length 0
12:11:16.540011 IP 192.168.70.197.55898 > helena.http: Flags [F.], seq 465, ack 705, win 501, options [nop,nop,TS val 1598359614 ecr 3189763444], length 0
12:11:16.541991 IP 192.168.70.197.36552 > 192.168.110.156.http: Flags [F.], seq 486, ack 551, win 501, options [nop,nop,TS val 1781033304 ecr 3189763423], length 0
12:11:16.569029 IP 192.168.70.197.38738 > 34.120.208.123.https: Flags [S], seq 1922166519, win 64240, options [mss 1460,sackOK,TS val 4075086846 ecr 0,nop,wscale 7], length 0
